{
  "schemaVersion": "1.1.0",
  "assessmentProcessingRunId": "sha256:1111111111111111111111111111111111111111111111111111111111111111",
  "cycleFeatureProcessingRunId": "sha256:2222222222222222222222222222222222222222222222222222222222222222",
  "machiningRunProcessingRunId": "sha256:3333333333333333333333333333333333333333333333333333333333333333",
  "machineId": "Mazak01",
  "cycleFeatureVersion": "1.0.0",
  "baselinePolicyVersion": "1.0.0",
  "anomalyAssessmentVersion": "2.0.0",
  "inputHash": "sha256:4444444444444444444444444444444444444444444444444444444444444444",
  "resultHash": "sha256:5555555555555555555555555555555555555555555555555555555555555555",
  "createdAt": "2026-09-04T03:00:00Z",
  "assessments": [{
    "assessmentId": "sha256:3333333333333333333333333333333333333333333333333333333333333333",
    "machiningRunId": "sha256:6666666666666666666666666666666666666666666666666666666666666666",
    "targetFeatureSetId": "sha256:4444444444444444444444444444444444444444444444444444444444444444",
    "dataStatus": "INSUFFICIENT_DATA",
    "baseline": {
      "baselineGroupId": "sha256:5555555555555555555555555555555555555555555555555555555555555555",
      "machineId": "Mazak01",
      "programName": "155",
      "cycleFeatureVersion": "1.0.0",
      "baselinePolicyVersion": "1.0.0",
      "targetFeatureSetId": "sha256:4444444444444444444444444444444444444444444444444444444444444444",
      "candidateFeatureSetIds": [],
      "trainingSourceRanges": [],
      "featureBaselines": [{
        "featureKey": "durationSeconds",
        "targetValue": 10.000000,
        "sampleCount": 0,
        "contributingFeatureSetIds": [],
        "unavailableReason": "MINIMUM_SAMPLE_COUNT_NOT_MET",
        "available": false
      }]
    },
    "evaluationSourceRange": {
      "replaySessionId": "00d64db8-967e-41ba-9d09-fdd087710aac",
      "firstReplaySequence": 1,
      "lastReplaySequence": 2,
      "firstSourceObservedAt": "2016-10-05T09:00:00Z",
      "lastSourceObservedAt": "2016-10-05T09:00:10Z",
      "firstSourceEventKey": "event-1",
      "lastSourceEventKey": "event-2"
    },
    "contributions": [],
    "topReasons": [],
    "lineage": {
      "origin": "DERIVED",
      "inputCycleFeature": {
        "origin": "DERIVED",
        "featureProcessingRunId": "sha256:2222222222222222222222222222222222222222222222222222222222222222",
        "cycleFeatureVersion": "1.0.0"
      },
      "sources": [{
        "kind": "REAL",
        "provider": "NIST",
        "sourceSetId": "nist-mazak01-20161005",
        "artifactId": "sha256:6666666666666666666666666666666666666666666666666666666666666666",
        "rawRecordId": "raw-1",
        "mappingVersion": "2.0.0",
        "sourceDataItemId": "execution"
      }]
    },
    "resultHash": "sha256:2222222222222222222222222222222222222222222222222222222222222222"
  }]
}
